{
  "$schema": "codec-typed-mat-benchmark-evidence.schema.json",
  "schemaVersion": 1,
  "status": "measured",
  "runner": {
    "os": "Microsoft Windows 10.0.26200",
    "architecture": "x64",
    "dotnet": "10.0.401",
    "configuration": "Release",
    "sourceCommit": "45ef1609a0232026c99cce657106e6eb3dd4faa5",
    "managedAssemblies": [
      {
        "targetFramework": "net8.0",
        "sha256": "8b4882cfebc1fda383f469eee90a26090c99da17c0f7a36a4e4c7873e3aef43b"
      },
      {
        "targetFramework": "net10.0",
        "sha256": "8825b0dfaa3dcf282683af75e195dccbc4a294c79d11713bfeb50e1805ecf121"
      }
    ],
    "nativeRuntimePackage": "jyppx.opencv.runtime.win-x64.5.0.0.nupkg",
    "nativeRuntimePackageSha256": "07de65af0ec14420d84d49caa4663d08393880a1bae402c789177d2dfff2544e",
    "nativePayload": [
      {
        "name": "JYPPX.OpenCV.Native.dll",
        "bytes": 1646080,
        "sha256": "522e5ca18591bc510661a69cd1b1d9f1b937b266bcbe9230a6dd00e720581d59"
      },
      {
        "name": "opencv_calib500.dll",
        "bytes": 1099776,
        "sha256": "966f6c8ecfd0659f2a5ff28a0280958413ea3fb0dad59461d8e161666ee8c472"
      },
      {
        "name": "opencv_core500.dll",
        "bytes": 5803520,
        "sha256": "3b8709f4dc4478cb2fa1af97b14e50a5756c601e8623f426fe3478330b50b68a"
      },
      {
        "name": "opencv_dnn500.dll",
        "bytes": 17764352,
        "sha256": "c8467204f81dd7e8e5ad29123b5d01273f509a7331d55bdde6e0a05dbc3a7c51"
      },
      {
        "name": "opencv_features500.dll",
        "bytes": 1371136,
        "sha256": "724a6dd07b09ffbce5f384d21eea30b62f8c53d5f5b729234b7ad92e663e1de3"
      },
      {
        "name": "opencv_flann500.dll",
        "bytes": 809984,
        "sha256": "1cadc60f1bedec53245665663768209a67feb3bfc49ce84691fb1672a9ef7ce4"
      },
      {
        "name": "opencv_geometry500.dll",
        "bytes": 3350016,
        "sha256": "642679ea6260e7a11560b2c532c72aa932e0eeb55de717e773731ee669b44f8b"
      },
      {
        "name": "opencv_highgui500.dll",
        "bytes": 679936,
        "sha256": "11d07e5b8d86c6d1aa3dea5490c80f7714159be7ea18f17406312e984abc10d3"
      },
      {
        "name": "opencv_imgcodecs500.dll",
        "bytes": 3500032,
        "sha256": "82460749076373cf81073c2a374854a6d78362a0c52a0886c8291bcf4973422f"
      },
      {
        "name": "opencv_imgproc500.dll",
        "bytes": 11042304,
        "sha256": "72e542fb4fcba81e75a30eefa708966b3168a144424416092c507a37e666ea1b"
      },
      {
        "name": "opencv_ml500.dll",
        "bytes": 1054208,
        "sha256": "a2962b72333b039ca48875106b3b839f8ecdcf9a8e6b2b036307225c7e585095"
      },
      {
        "name": "opencv_objdetect500.dll",
        "bytes": 2651648,
        "sha256": "7af553b712e163e09dd7b17b714293cee4fb68da32d318735b05415079873432"
      },
      {
        "name": "opencv_photo500.dll",
        "bytes": 1441792,
        "sha256": "43c94da5c28d1b92c10cabd867c41334d06685c65aea183542a2f7125051259d"
      },
      {
        "name": "opencv_ptcloud500.dll",
        "bytes": 1358848,
        "sha256": "31268ee2f8e42b751ad114573fb9ad04a4346462e9de71e0b280241b95786487"
      },
      {
        "name": "opencv_stereo500.dll",
        "bytes": 329216,
        "sha256": "b2f31140874101bb96a7185a61ed997418975770936483cdc20fbe21de61dd48"
      },
      {
        "name": "opencv_stitching500.dll",
        "bytes": 1558016,
        "sha256": "e383b3433597a7dee121f1ada6944be5b3036535c27cbd778839019f5f5b41f8"
      },
      {
        "name": "opencv_video500.dll",
        "bytes": 1244160,
        "sha256": "ca6bdf798a8c425183ed119544fcd4278e7b0aab37c21b82ef0eb7e6e17c7ec8"
      },
      {
        "name": "opencv_videoio500.dll",
        "bytes": 989184,
        "sha256": "438fa0e7fe474ee435afaafab46ef63852073625f4c1e4c4aac1ddc0c8b6564e"
      }
    ]
  },
  "codec": {
    "status": "measured",
    "targetFramework": "net8.0",
    "packageVersion": "5.0.0",
    "openCvVersion": "5.0.0",
    "iterations": 100,
    "rows": 64,
    "columns": 64,
    "inputBytes": 12288,
    "inputSha256": "518f05b99bd5822f768487e0c9c969b3f6b5ba24f1b1531df4231f674413a0af",
    "encodedBytes": 320,
    "encodedSha256": "6b6e6ecadaaf63226bc2c438ecd4c97aee334bce425ddee6e5185766646c2779",
    "encodeByteArray": {
      "managedAllocatedBytes": 37640,
      "encodedBytes": 320,
      "elapsedTicks": 34442
    },
    "encodeBufferWriter": {
      "managedAllocatedBytes": 40840,
      "encodedBytes": 320,
      "elapsedTicks": 32164
    },
    "encodeBufferWriterReused": {
      "managedAllocatedBytes": 3240,
      "encodedBytes": 320,
      "elapsedTicks": 36025,
      "getSpanCalls": 100,
      "advanceCalls": 100,
      "writerCapacity": 4096,
      "writerReused": true
    },
    "decodeByteArray": {
      "managedAllocatedBytes": 7240,
      "decodedBytes": 12288,
      "checksum": 156672000,
      "elapsedTicks": 75055
    },
    "decodeSpanWithPreflight": {
      "managedAllocatedBytes": 60840,
      "decodedBytes": 12288,
      "checksum": 156672000,
      "elapsedTicks": 57147
    },
    "decodeStreamWithPreflight": {
      "managedAllocatedBytes": 8296040,
      "decodedBytes": 12288,
      "checksum": 156672000,
      "elapsedTicks": 88042
    }
  },
  "typedMat": [
    {
      "status": "measured",
      "targetFramework": "net8.0",
      "iterations": 100,
      "rows": 118,
      "columns": 122,
      "inputSha256": "70986737435b5f89e119558ba7d29e5bb8768dd18c16beaaaa09298bf586b275",
      "rowAccessor": {
        "managedAllocatedBytes": 40,
        "elapsedTicks": 10807,
        "checksum": 10077200
      },
      "matView": {
        "managedAllocatedBytes": 10440,
        "elapsedTicks": 72028,
        "checksum": 10077200
      },
      "readOnlyMatView": {
        "managedAllocatedBytes": 12840,
        "elapsedTicks": 74124,
        "checksum": 10077200
      }
    },
    {
      "status": "measured",
      "targetFramework": "net10.0",
      "iterations": 100,
      "rows": 118,
      "columns": 122,
      "inputSha256": "70986737435b5f89e119558ba7d29e5bb8768dd18c16beaaaa09298bf586b275",
      "rowAccessor": {
        "managedAllocatedBytes": 40,
        "elapsedTicks": 11032,
        "checksum": 10077200
      },
      "matView": {
        "managedAllocatedBytes": 10440,
        "elapsedTicks": 65717,
        "checksum": 10077200
      },
      "readOnlyMatView": {
        "managedAllocatedBytes": 12840,
        "elapsedTicks": 66443,
        "checksum": 10077200
      }
    }
  ],
  "limitations": [
    "Each scenario measures 100 warmed iterations and records runner-specific allocation and elapsed-tick regression evidence.",
    "The codec, typed Mat, and paired Video/DNN records use the same exact win-x64 native NuGet package hash and the same source commit.",
    "The native runtime package is the factual OpenCV 5.0.0 full runtime identified by package and per-DLL hashes; it is not claimed to be rebuilt from this managed source commit.",
    "The Stream decode path includes full managed preflight buffering and is expected to allocate more than the byte-array and span paths."
  ]
}
